### ISSUE TITLE
some protocol violations

### ISSUE THREAD

**Issue by pipimonkey35** [eclipse/mosquitto#3319]
Hi, I found something on the mosquitto that is contrary to the protocol specification description (protocol violation or logic bug).
For tracking purposes, I will report all results under this Issue.
Environment Details
- mosquitto version 2.0.22
- Operating system and version: Ubuntu 22.04

### 1. 
According to the specification of [MQTT-v5.0](https://docs.oasis-open.org/mqtt/mqtt/v5.0/csprd02/mqtt-v5.0-csprd02.html)
```
The ShareName MUST NOT contain the characters '/', '+' or '#', but MUST be followed by a '/' character. The '/' character MUST be followed by a Topic Filter [MQTT-4.8.2-2] as described in section 4.7.
```
We conducted a detailed analysis of the relevant code and found that sub__topic_tokenise lacks logic to check whether the ShareName contains a "/" character. Although there also appears to be no explicit check for "+" and "#", these cases are already validated earlier in the processing context.

### 2. 
According to the specification of [MQTT-v5.0](https://docs.oasis-open.org/mqtt/mqtt/v5.0/csprd02/mqtt-v5.0-csprd02.html)
```
A PUBLISH packet sent from a Client to a Server MUST NOT contain a Subscription Identifier [MQTT-3.3.4-6].
```
Replay such packet:
```
# Test script to verify violation in Mosquitto broker:
# Subscription Identifiers should not be allowed in PUBLISH packets from clients,
# but the current implementation allows them.

import socket
import time
import struct
import sys

# Define MQTT constants
MQTT_V5 = 5
CONNECT = 0x10
CONNACK = 0x20
PUBLISH = 0x30
DISCONNECT = 0xE0

# MQTT v5 Properties
PROP_SUBSCRIPTION_IDENTIFIER = 11

def encode_remaining_length(length):
    result = bytearray()
    while True:
        byte = length % 128
        length = length // 128
        if length > 0:
            byte |= 0x80
        result.append(byte)
        if length == 0:
            break
    return bytes(result)

def encode_string(s):
    if isinstance(s, str):
        s = s.encode('utf-8')
    return struct.pack("!H", len(s)) + s

def encode_variable_byte_int(value):
    result = bytearray()
    while True:
        byte = value % 128
        value = value // 128
        if value > 0:
            byte |= 0x80
        result.append(byte)
        if value == 0:
            break
    return bytes(result)

def create_connect_packet(client_id):
    # Fixed header
    fixed_header = bytes([CONNECT])
    
    # Variable header
    protocol_name = encode_string("MQTT")
    protocol_version = bytes([MQTT_V5])
    connect_flags = bytes([0x02])  # Clean session flag
    keep_alive = struct.pack("!H", 60)
    
    # Properties
    properties = bytes([0])  # Empty properties
    
    # Payload
    payload = encode_string(client_id)
    
    # Calculate remaining length
    remaining_length = len(protocol_name) + 1 + 1 + 2 + 1 + len(payload)
    
    return fixed_header + encode_remaining_length(remaining_length) + protocol_name + protocol_version + connect_flags + keep_alive + properties + payload

def create_publish_packet_with_subscription_id(topic, payload, subscription_id):
    # Fixed header (QoS 0)
    fixed_header = bytes([PUBLISH])
    
    # Variable header
    topic_name = encode_string(topic)
    
    # Properties
    # Add a Subscription Identifier property (which should be rejected)
    prop_bytes = bytes([PROP_SUBSCRIPTION_IDENTIFIER]) + encode_variable_byte_int(subscription_id)
    properties = encode_variable_byte_int(len(prop_bytes)) + prop_bytes
    
    # Payload
    if isinstance(payload, str):
        payload = payload.encode('utf-8')
    
    # Calculate remaining length
    remaining_length = len(topic_name) + len(properties) + len(payload)
    
    return fixed_header + encode_remaining_length(remaining_length) + topic_name + properties + payload

def main():
    # Default Mosquitto port
    port = 1883
    
    # Create a socket connection
    sock = socket.socket(socket.AF_INET, socket.SOCK_STREAM)
    
    try:
        # Connect to Mosquitto
        print(f"Connecting to localhost:{port}")
        sock.connect(("localhost", port))
        
        # Send CONNECT packet
        connect_packet = create_connect_packet("test-client")
        print("Sending CONNECT packet")
        sock.send(connect_packet)
        
        # Wait for CONNACK
        connack = sock.recv(4)
        if len(connack) < 4 or connack[0] != CONNACK:
            print("Failed to receive CONNACK")
            return 1
        
        print("Successfully connected")
        
        # Send PUBLISH with Subscription Identifier (should be rejected but won't be)
        publish_packet = create_publish_packet_with_subscription_id("test/topic", "test message", 12345)
        print("Sending PUBLISH packet with Subscription Identifier")
        sock.send(publish_packet)
        
        # Wait a moment to see if we get disconnected (we should if the broker correctly implements the spec)
        time.sleep(1)
        
        # Check if we're still connected
        try:
            # Try to send another packet
            sock.send(bytes([0xC0, 0x00]))  # PINGREQ
            ping_response = sock.recv(2)
            
            if ping_response and len(ping_response) >= 2:
                print("VIOLATION CONFIRMED: Server accepted PUBLISH with Subscription Identifier")
                print("The broker should have disconnected us but didn't.")
            else:
                print("Server correctly rejected the PUBLISH packet")
        except:
            print("Connection closed by server (correct behavior)")
            return 0
            
    except Exception as e:
        print(f"Error: {e}")
        return 1
    finally:
        sock.close()
        
    return 0

if __name__ == "__main__":
    sys.exit(main())
```

According to the protocol specifications, a PUBLISH message sent by a client to a server must never contain a Subscription Identifier. However, in actual operation, it is found that the server accepts PUBLISH messages with a Subscription Identifier, which violates the protocol rules.

<img width="682" height="157" alt="Image" src="https://github.com/user-attachments/assets/b1ef73c1-fdea-4643-91dd-63a347272302" />

### 3. 

According to the specification of MQTTv5.0
```
# Publish
A Protocol Error occurs if the Subscription Identifier has a value of 0.
```
The problem is similar to the one above.

### 4. 
According to the specification of MQTTv5.0
```
In the case of overlapping subscriptions, the Server MUST deliver the message to the Client respecting the maximum QoS of all the matching subscriptions [MQTT-3.3.4-2].
```

According to the specification, the server is required to determine the maximum QoS level among all overlapping subscriptions for a client and deliver messages using that QoS. However, the current implementation does not collect or consider all matching subscription QoS levels. As a result, the server may deliver messages using a lower QoS than required, leading to a protocol violation.
Reproduce
A subscriber:
1. Sent SUBSCRIBE(topic=sensor/test, qos=1)
2. Sent SUBSCRIBE(topic=sensor/+, qos=0)
A publisher:
3. Sent a PUBLISH packet with topic=sensor/test and qos=2
The subscriber subsequently receives two PUBLISH packets: one with qos=1 and one with qos=0.
This demonstrates that Mosquitto handles each overlapping subscription independently, instead of considering the maximum QoS among all matching subscriptions, which violates the specification.

```
root@5bfa19bcb2f8:~/projects/mosquitto# tshark -i any -f "tcp port 1883" -V -O "mqtt"  
Running as user "root" and group "root". This could be dangerous.
Capturing on 'any'
 ** (tshark:3850151) 14:55:27.884529 [Main MESSAGE] -- Capture started.
 ** (tshark:3850151) 14:55:27.884593 [Main MESSAGE] -- File: "/tmp/wireshark_anyM5LN92.pcapng"
^C0 packets captured
root@5bfa19bcb2f8:~/projects/mosquitto# tshark -i any -f "tcp port 1883" -V -O "mqtt" -Y "mqtt"
Running as user "root" and group "root". This could be dangerous.
Capturing on 'any'
 ** (tshark:3850348) 14:55:33.636423 [Main MESSAGE] -- Capture started.
 ** (tshark:3850348) 14:55:33.636463 [Main MESSAGE] -- File: "/tmp/wireshark_anyHPEI92.pcapng"
Frame 4: 100 bytes on wire (800 bits), 100 bytes captured (800 bits) on interface any, id 0
Linux cooked capture v1
Internet Protocol Version 4, Src: 127.0.0.1, Dst: 127.0.0.1
Transmission Control Protocol, Src Port: 44314, Dst Port: 1883, Seq: 1, Ack: 1, Len: 32
MQ Telemetry Transport Protocol, Connect Command
    Header Flags: 0x10, Message Type: Connect Command
        0001 .... = Message Type: Connect Command (1)
        .... 0000 = Reserved: 0
    Msg Len: 30
    Protocol Name Length: 4
    Protocol Name: MQTT
    Version: MQTT v5.0 (5)
    Connect Flags: 0x02, QoS Level: At most once delivery (Fire and Forget), Clean Session Flag
        0... .... = User Name Flag: Not set
        .0.. .... = Password Flag: Not set
        ..0. .... = Will Retain: Not set
        ...0 0... = QoS Level: At most once delivery (Fire and Forget) (0)
        .... .0.. = Will Flag: Not set
        .... ..1. = Clean Session Flag: Set
        .... ...0 = (Reserved): Not set
    Keep Alive: 60
    Properties
        Total Length: 0
    Client ID Length: 17
    Client ID: subscriber_client

Frame 6: 79 bytes on wire (632 bits), 79 bytes captured (632 bits) on interface any, id 0
Linux cooked capture v1
Internet Protocol Version 4, Src: 127.0.0.1, Dst: 127.0.0.1
Transmission Control Protocol, Src Port: 1883, Dst Port: 44314, Seq: 1, Ack: 33, Len: 11
MQ Telemetry Transport Protocol, Connect Ack
    Header Flags: 0x20, Message Type: Connect Ack
        0010 .... = Message Type: Connect Ack (2)
        .... 0000 = Reserved: 0
    Msg Len: 9
    Acknowledge Flags: 0x00
        0000 000. = Reserved: Not set
        .... ...0 = Session Present: Not set
    Reason Code: Success (0)
    Properties
        Total Length: 6
        ID: Topic Alias Maximum (0x22)
        Value: 10
        ID: Receive Maximum (0x21)
        Value: 20

Frame 8: 87 bytes on wire (696 bits), 87 bytes captured (696 bits) on interface any, id 0
Linux cooked capture v1
Internet Protocol Version 4, Src: 127.0.0.1, Dst: 127.0.0.1
Transmission Control Protocol, Src Port: 44314, Dst Port: 1883, Seq: 33, Ack: 12, Len: 19
MQ Telemetry Transport Protocol, Subscribe Request
    Header Flags: 0x82, Message Type: Subscribe Request
        1000 .... = Message Type: Subscribe Request (8)
        .... 0010 = Reserved: 2
    Msg Len: 17
    Message Identifier: 1
    Properties
        Total Length: 0
    Topic Length: 11
    Topic: sensor/test
    Subscription Options: 0x01, Retain Handling: Send msgs at subscription time, QoS: At least once delivery (Acknowledged deliver)
        00.. .... = Reserved: 0x0
        ..00 .... = Retain Handling: Send msgs at subscription time (0)
        .... 0... = Retain As Published: Not set
        .... .0.. = No Local: Not set
        .... ..01 = QoS: At least once delivery (Acknowledged deliver) (1)

Frame 9: 74 bytes on wire (592 bits), 74 bytes captured (592 bits) on interface any, id 0
Linux cooked capture v1
Internet Protocol Version 4, Src: 127.0.0.1, Dst: 127.0.0.1
Transmission Control Protocol, Src Port: 1883, Dst Port: 44314, Seq: 12, Ack: 52, Len: 6
MQ Telemetry Transport Protocol, Subscribe Ack
    Header Flags: 0x90, Message Type: Subscribe Ack
        1001 .... = Message Type: Subscribe Ack (9)
        .... 0000 = Reserved: 0
    Msg Len: 4
    Message Identifier: 1
    Properties
        Total Length: 0
    Reason Code: Granted QoS 1 (1)

Frame 10: 84 bytes on wire (672 bits), 84 bytes captured (672 bits) on interface any, id 0
Linux cooked capture v1
Internet Protocol Version 4, Src: 127.0.0.1, Dst: 127.0.0.1
Transmission Control Protocol, Src Port: 44314, Dst Port: 1883, Seq: 52, Ack: 18, Len: 16
MQ Telemetry Transport Protocol, Subscribe Request
    Header Flags: 0x82, Message Type: Subscribe Request
        1000 .... = Message Type: Subscribe Request (8)
        .... 0010 = Reserved: 2
    Msg Len: 14
    Message Identifier: 2
    Properties
        Total Length: 0
    Topic Length: 8
    Topic: sensor/+
    Subscription Options: 0x00, Retain Handling: Send msgs at subscription time, QoS: At most once delivery (Fire and Forget)
        00.. .... = Reserved: 0x0
        ..00 .... = Retain Handling: Send msgs at subscription time (0)
        .... 0... = Retain As Published: Not set
        .... .0.. = No Local: Not set
        .... ..00 = QoS: At most once delivery (Fire and Forget) (0)

Frame 11: 74 bytes on wire (592 bits), 74 bytes captured (592 bits) on interface any, id 0
Linux cooked capture v1
Internet Protocol Version 4, Src: 127.0.0.1, Dst: 127.0.0.1
Transmission Control Protocol, Src Port: 1883, Dst Port: 44314, Seq: 18, Ack: 68, Len: 6
MQ Telemetry Transport Protocol, Subscribe Ack
    Header Flags: 0x90, Message Type: Subscribe Ack
        1001 .... = Message Type: Subscribe Ack (9)
        .... 0000 = Reserved: 0
    Msg Len: 4
    Message Identifier: 2
    Properties
        Total Length: 0
    Reason Code: Granted QoS 0 (0)

Frame 16: 99 bytes on wire (792 bits), 99 bytes captured (792 bits) on interface any, id 0
Linux cooked capture v1
Internet Protocol Version 4, Src: 127.0.0.1, Dst: 127.0.0.1
Transmission Control Protocol, Src Port: 44326, Dst Port: 1883, Seq: 1, Ack: 1, Len: 31
MQ Telemetry Transport Protocol, Connect Command
    Header Flags: 0x10, Message Type: Connect Command
        0001 .... = Message Type: Connect Command (1)
        .... 0000 = Reserved: 0
    Msg Len: 29
    Protocol Name Length: 4
    Protocol Name: MQTT
    Version: MQTT v5.0 (5)
    Connect Flags: 0x02, QoS Level: At most once delivery (Fire and Forget), Clean Session Flag
        0... .... = User Name Flag: Not set
        .0.. .... = Password Flag: Not set
        ..0. .... = Will Retain: Not set
        ...0 0... = QoS Level: At most once delivery (Fire and Forget) (0)
        .... .0.. = Will Flag: Not set
        .... ..1. = Clean Session Flag: Set
        .... ...0 = (Reserved): Not set
    Keep Alive: 60
    Properties
        Total Length: 0
    Client ID Length: 16
    Client ID: publisher_client

Frame 18: 79 bytes on wire (632 bits), 79 bytes captured (632 bits) on interface any, id 0
Linux cooked capture v1
Internet Protocol Version 4, Src: 127.0.0.1, Dst: 127.0.0.1
Transmission Control Protocol, Src Port: 1883, Dst Port: 44326, Seq: 1, Ack: 32, Len: 11
MQ Telemetry Transport Protocol, Connect Ack
    Header Flags: 0x20, Message Type: Connect Ack
        0010 .... = Message Type: Connect Ack (2)
        .... 0000 = Reserved: 0
    Msg Len: 9
    Acknowledge Flags: 0x00
        0000 000. = Reserved: Not set
        .... ...0 = Session Present: Not set
    Reason Code: Success (0)
    Properties
        Total Length: 6
        ID: Topic Alias Maximum (0x22)
        Value: 10
        ID: Receive Maximum (0x21)
        Value: 20

Frame 20: 121 bytes on wire (968 bits), 121 bytes captured (968 bits) on interface any, id 0
Linux cooked capture v1
Internet Protocol Version 4, Src: 127.0.0.1, Dst: 127.0.0.1
Transmission Control Protocol, Src Port: 44326, Dst Port: 1883, Seq: 32, Ack: 12, Len: 53
MQ Telemetry Transport Protocol, Publish Message
    Header Flags: 0x34, Message Type: Publish Message, QoS Level: Exactly once delivery (Assured Delivery)
        0011 .... = Message Type: Publish Message (3)
        .... 0... = DUP Flag: Not set
        .... .10. = QoS Level: Exactly once delivery (Assured Delivery) (2)
        .... ...0 = Retain: Not set
    Msg Len: 51
    Topic Length: 11
    Topic: sensor/test
    Message Identifier: 1
    Properties
        Total Length: 0
    Message: 48656c6c6f2066726f6d207075626c69736865722120516f532032206d657373616765

Frame 21: 72 bytes on wire (576 bits), 72 bytes captured (576 bits) on interface any, id 0
Linux cooked capture v1
Internet Protocol Version 4, Src: 127.0.0.1, Dst: 127.0.0.1
Transmission Control Protocol, Src Port: 1883, Dst Port: 44326, Seq: 12, Ack: 85, Len: 4
MQ Telemetry Transport Protocol, Publish Received
    Header Flags: 0x50, Message Type: Publish Received
        0101 .... = Message Type: Publish Received (5)
        .... 0000 = Reserved: 0
    Msg Len: 2
    Message Identifier: 1

Frame 23: 72 bytes on wire (576 bits), 72 bytes captured (576 bits) on interface any, id 0
Linux cooked capture v1
Internet Protocol Version 4, Src: 127.0.0.1, Dst: 127.0.0.1
Transmission Control Protocol, Src Port: 44326, Dst Port: 1883, Seq: 85, Ack: 16, Len: 4
MQ Telemetry Transport Protocol, Publish Release
    Header Flags: 0x62, Message Type: Publish Release
        0110 .... = Message Type: Publish Release (6)
        .... 0010 = Reserved: 2
    Msg Len: 2
    Message Identifier: 1

Frame 24: 121 bytes on wire (968 bits), 121 bytes captured (968 bits) on interface any, id 0
Linux cooked capture v1
Internet Protocol Version 4, Src: 127.0.0.1, Dst: 127.0.0.1
Transmission Control Protocol, Src Port: 1883, Dst Port: 44314, Seq: 24, Ack: 68, Len: 53
MQ Telemetry Transport Protocol, Publish Message
    Header Flags: 0x32, Message Type: Publish Message, QoS Level: At least once delivery (Acknowledged deliver)
        0011 .... = Message Type: Publish Message (3)
        .... 0... = DUP Flag: Not set
        .... .01. = QoS Level: At least once delivery (Acknowledged deliver) (1)
        .... ...0 = Retain: Not set
    Msg Len: 51
    Topic Length: 11
    Topic: sensor/test
    Message Identifier: 1
    Properties
        Total Length: 0
    Message: 48656c6c6f2066726f6d207075626c69736865722120516f532032206d657373616765

Frame 26: 119 bytes on wire (952 bits), 119 bytes captured (952 bits) on interface any, id 0
Linux cooked capture v1
Internet Protocol Version 4, Src: 127.0.0.1, Dst: 127.0.0.1
Transmission Control Protocol, Src Port: 1883, Dst Port: 44314, Seq: 77, Ack: 68, Len: 51
MQ Telemetry Transport Protocol, Publish Message
    Header Flags: 0x30, Message Type: Publish Message, QoS Level: At most once delivery (Fire and Forget)
        0011 .... = Message Type: Publish Message (3)
        .... 0... = DUP Flag: Not set
        .... .00. = QoS Level: At most once delivery (Fire and Forget) (0)
        .... ...0 = Retain: Not set
    Msg Len: 49
    Topic Length: 11
    Topic: sensor/test
    Properties
        Total Length: 0
    Message: 48656c6c6f2066726f6d207075626c69736865722120516f532032206d657373616765

Frame 28: 72 bytes on wire (576 bits), 72 bytes captured (576 bits) on interface any, id 0
Linux cooked capture v1
Internet Protocol Version 4, Src: 127.0.0.1, Dst: 127.0.0.1
Transmission Control Protocol, Src Port: 1883, Dst Port: 44326, Seq: 16, Ack: 89, Len: 4
MQ Telemetry Transport Protocol, Publish Complete
    Header Flags: 0x70, Message Type: Publish Complete
        0111 .... = Message Type: Publish Complete (7)
        .... 0000 = Reserved: 0
    Msg Len: 2
    Message Identifier: 1

Frame 29: 70 bytes on wire (560 bits), 70 bytes captured (560 bits) on interface any, id 0
Linux cooked capture v1
Internet Protocol Version 4, Src: 127.0.0.1, Dst: 127.0.0.1
Transmission Control Protocol, Src Port: 44326, Dst Port: 1883, Seq: 89, Ack: 20, Len: 2
MQ Telemetry Transport Protocol, Disconnect Req
    Header Flags: 0xe0, Message Type: Disconnect Req
        1110 .... = Message Type: Disconnect Req (14)
        .... 0000 = Reserved: 0
    Msg Len: 0

Frame 33: 70 bytes on wire (560 bits), 70 bytes captured (560 bits) on interface any, id 0
Linux cooked capture v1
Internet Protocol Version 4, Src: 127.0.0.1, Dst: 127.0.0.1
Transmission Control Protocol, Src Port: 44314, Dst Port: 1883, Seq: 68, Ack: 128, Len: 2
MQ Telemetry Transport Protocol, Disconnect Req
    Header Flags: 0xe0, Message Type: Disconnect Req
        1110 .... = Message Type: Disconnect Req (14)
        .... 0000 = Reserved: 0
    Msg Len: 0
```

### 5. 
According to the specification of MQTTv5.0
```
If the Topic Alias Maximum value is absent or zero, the Server MUST NOT send any Topic Aliases to the Client [MQTT-3.1.2-27].
```

We found this issue particularly interesting: the code does not verify whether the client's Topic Alias Maximum is zero or absent before including a Topic Alias in PUBLISH packets. Moreover, even when we explicitly craft a CONNECT message with the Topic Alias Maximum value set to 0, the server consistently responds with a CONNACK message that includes a Topic Alias Maximum value of 10.

**Comment by ralight** [comment]
Thanks for the report.

1. This is a bit of an odd requirement. The `/` character is the separator so it's essentially impossible for the sharename to contain it. It's more of an instruction for end users - don't try to put a / in your sharename - than something for implementors to worry about. You missed that a single `+` is still allowed - it was already forbidden when the sharename was >1 character long.

2. Thank you, this is now fixed in the develop branch.

3. I think you're mistaken, there were already explicit tests for this case. If you meant the library code, that is covered as well.

4. Agreed, this is an error. I've no intention of fixing it at the moment, it needs bigger changes.

5. I think you're mistaken here. In 2.0.22 the broker doesn't create instruct the client about aliases. It *does* accept incoming aliases from the client. I think that may be where you are mixing things up. When the client sends topic-alias-maximum=0 it is saying to the broker "don't use aliases when sending publishes to me". Even in this case the broker is perfectly free to send topic-alias-maximum=10 in the CONNACK, so that the client knows that the broker will accept topic aliases. The broker to client and client to broker topic aliases are completely unrelated.

The only point outstanding is 4, which is not being fixed for the time being. As such I'm going to consider this issue finished. Thanks again.
