### ISSUE TITLE
connect_callback() not called on reconnections, when using my own loop handler.

### ISSUE THREAD

**Issue by doragasu** [eclipse/mosquitto#1043]
This bug might be related to Issue #990 that I reported some time ago and was fixed (for the connection at least, but it seems not for reconnections).

I am using this minimal [non] working program:

```c
#include <mosquitto.h>
#include <stdio.h>
#include <sys/epoll.h>
#include <unistd.h>

#define USERNAME	"my_username"
#define PASSWORD	"my_password"
#define HOST		"my_broker.com"
#define CLIENT_ID 	USERNAME
#define PORT		8883
#define KEEPALIVE	60

#define EVENTS 		(EPOLLIN | EPOLLOUT | EPOLLERR | EPOLLHUP | EPOLLRDHUP | EPOLLET)

static bool connected = false;

static void connect_cb(struct mosquitto *mosq, void *priv, int rc)
{
	printf("%s: %i received (%s)\n", __func__, rc, mosquitto_connack_string(rc));
	connected = true;

	// Subscribe
	mosquitto_subscribe(mosq, NULL, "test/topic/#", 0);
}

static void disconnect_cb(struct mosquitto *mosq, void *priv, int rc)
{
	connected = false;
	printf("%s: %i received (%s)\n", __func__, rc, mosquitto_connack_string(rc));
}

static void publish_cb(struct mosquitto *mosq, void *priv, int rc)
{
	printf("%s: %i received\n", __func__, rc);
}

static void message_cb(struct mosquitto *mosq, void *priv, const struct mosquitto_message *msg)
{
	printf("%s: received %d bytes\n", __func__, msg->payloadlen);
}

static void subscribe_cb(struct mosquitto *mosq, void *priv, int mid, int qos_count, const int *granted_qos)
{
	printf("%s: %i %i received\n", __func__, mid, qos_count);
}

static void unsubscribe_cb(struct mosquitto *mosq, void *priv, int rc)
{
	printf("%s: %i received\n", __func__, rc);
}

static void log_cb(struct mosquitto *mosq, void *priv, int level, const char *msg)
{
	printf("%s: %i %s\n", __func__, level, msg);
}

static struct mosquitto* mosq_init(void)
{
	struct mosquitto *mosq = NULL;
	const char *client_id = CLIENT_ID;
	int err = 0;

	err = mosquitto_lib_init();
	if (!err) {
		mosq = mosquitto_new(client_id, true, NULL);
		err = mosq == NULL?-2:0;
	}
	if (!err) err = mosquitto_username_pw_set(mosq, USERNAME, PASSWORD);
	if (!err) err = mosquitto_tls_set(mosq, NULL, "/etc/ssl/certs", NULL, NULL, NULL);
	if (!err) {
		mosquitto_connect_callback_set(mosq, connect_cb);
		mosquitto_disconnect_callback_set(mosq, disconnect_cb);
		mosquitto_publish_callback_set(mosq, publish_cb);
		mosquitto_message_callback_set(mosq, message_cb);
		mosquitto_subscribe_callback_set(mosq, subscribe_cb);
		mosquitto_unsubscribe_callback_set(mosq, unsubscribe_cb);
		mosquitto_log_callback_set(mosq, log_cb);
		mosquitto_max_pub_queue_messages_set(mosq, 1000);
	}
	printf("%s: code %d\n", __func__, err);

	if (err && mosq) {
		mosquitto_destroy(mosq);
		mosq = NULL;
	}

	return mosq;
}

static void reconnect_test(struct mosquitto *mosq)
{
	static int iterations = 0;

	if (connected) {
		iterations++;
		// 10 seconds aprox
		if (iterations >= 40) {
			printf("%s: triggering reconnect\n", __func__);
			mosquitto_reconnect(mosq);
			connected = false;
			iterations = 0;
		}
	} else {
		iterations = 0;
	}
}

int main(void)
{
	struct mosquitto *mosq = NULL;
	int mosq_socket = -1;
	int err = -1;
	int epfd = -1;
	struct epoll_event ev;
	int writes = 0;
	int reads = 0;

	// Init and connect
	mosq = mosq_init();
	if (mosq) err = mosquitto_connect(mosq, HOST, PORT, KEEPALIVE);

	if (!err) {
		epfd = epoll_create1(0);
		err = epfd < 0?-3:0;
	}
	if (!err) {
		mosq_socket = mosquitto_socket(mosq);
		ev.data.fd = mosq_socket;
		ev.events = EVENTS;
		err = epoll_ctl(epfd, EPOLL_CTL_ADD, mosq_socket, &ev);
	}

	// Loop
	while (!err) {
		err = epoll_wait(epfd, &ev, 1, 250);
		if (err < 0) err = -4;
		else if (err > 0) {
			// Event
			err = -5;
			if (ev.events & EPOLLIN) {
				printf("read %d triggered\n", ++reads);
				mosquitto_loop_read(mosq, 1);
				err = 0;
			}
			if (ev.events & EPOLLOUT) {
				if (mosquitto_want_write(mosq)) {
					printf("write %d triggered\n", ++writes);
					mosquitto_loop_write(mosq, 1);
				}
				err = 0;
			}
		}
		mosquitto_loop_misc(mosq);
		reconnect_test(mosq);
	}

	printf("%s: ERROR %d\n", __func__, err);

	return err;
}
```
The program connects to the broker and subscribes successfully. But after about 10 seconds, I run `mosquitto_reconnect()`, and apparently reconnect runs correctly, but the connect callback function is not run:
```
jalon mosq_test $ ./mosq_test 
mosq_init: code 0
log_cb: 16 Client guest sending CONNECT
read 1 triggered
read 2 triggered
read 3 triggered
write 1 triggered
read 4 triggered
log_cb: 16 Client guest received CONNACK (0)
connect_cb: 0 received (Connection Accepted.)
log_cb: 16 Client guest sending SUBSCRIBE (Mid: 1, Topic: test/topic/#, QoS: 0)
write 2 triggered
read 5 triggered
log_cb: 16 Client guest received SUBACK
subscribe_cb: 1 1 received
reconnect_test: triggering reconnect
log_cb: 16 Client guest sending CONNECT
```
In the network capture, it seems that the reconnection completes correctly:
```
0.009747794  TCP      76     60222 → 8883 [SYN] Seq=0 Win=26280 Len=0 MSS=1314 SACK_PERM=1 TSval=1473341504 TSecr=0 WS=128
0.054866807  TCP      76     8883 → 60222 [SYN, ACK] Seq=0 Ack=1 Win=28960 Len=0 MSS=1460 SACK_PERM=1 TSval=649279318 TSecr=1473341504 WS=256
0.054921571  TCP      68     60222 → 8883 [ACK] Seq=1 Ack=1 Win=26368 Len=0 TSval=1473341549 TSecr=649279318
0.055762660  TLSv1.2  411    Client Hello
0.102093600  TCP      68     8883 → 60222 [ACK] Seq=1 Ack=344 Win=30208 Len=0 TSval=649279329 TSecr=1473341550
0.102094762  TLSv1.2  1370   Server Hello
0.102138532  TCP      68     60222 → 8883 [ACK] Seq=344 Ack=1303 Win=28928 Len=0 TSval=1473341597 TSecr=649279329
0.102254644  TCP      1370   8883 → 60222 [ACK] Seq=1303 Ack=344 Win=30208 Len=1302 TSval=649279329 TSecr=1473341550 [TCP segment of a reassembled PDU]
0.102297890  TCP      68     60222 → 8883 [ACK] Seq=344 Ack=2605 Win=31488 Len=0 TSval=1473341597 TSecr=649279329
0.102256067  TCP      1370   8883 → 60222 [ACK] Seq=2605 Ack=344 Win=30208 Len=1302 TSval=649279329 TSecr=1473341550 [TCP segment of a reassembled PDU]
0.102256652  TCP      258    8883 → 60222 [PSH, ACK] Seq=3907 Ack=344 Win=30208 Len=190 TSval=649279329 TSecr=1473341550 [TCP segment of a reassembled PDU]
0.102336368  TCP      68     60222 → 8883 [ACK] Seq=344 Ack=3907 Win=34176 Len=0 TSval=1473341597 TSecr=649279329
0.102360205  TCP      68     60222 → 8883 [ACK] Seq=344 Ack=4097 Win=36736 Len=0 TSval=1473341597 TSecr=649279329
0.103045932  TLSv1.2  1006   Certificate, Server Key Exchange, Server Hello Done
0.103076372  TCP      68     60222 → 8883 [ACK] Seq=344 Ack=5035 Win=39424 Len=0 TSval=1473341598 TSecr=649279329
0.105306253  TLSv1.2  194    Client Key Exchange, Change Cipher Spec, Encrypted Handshake Message
0.150947990  TLSv1.2  119    Change Cipher Spec, Encrypted Handshake Message
0.151226358  TLSv1.2  130    Application Data
0.197911832  TLSv1.2  101    Application Data
0.198171164  TLSv1.2  143    Application Data
0.246108347  TLSv1.2  102    Application Data
0.286263225  TCP      68     60222 → 8883 [ACK] Seq=607 Ack=5153 Win=39424 Len=0 TSval=1473341781 TSecr=649279365
9.756942334  TLSv1.2  99     Encrypted Alert
9.757160519  TCP      68     60222 → 8883 [FIN, ACK] Seq=638 Ack=5153 Win=39424 Len=0 TSval=1473351252 TSecr=649279365
9.769829702  TCP      76     44766 → 8883 [SYN] Seq=0 Win=26280 Len=0 MSS=1314 SACK_PERM=1 TSval=2602525461 TSecr=0 WS=128
9.805801825  TLSv1.2  99     Encrypted Alert
9.805860766  TCP      56     60222 → 8883 [RST] Seq=639 Win=0 Len=0
9.805803389  TCP      68     8883 → 60222 [FIN, ACK] Seq=5184 Ack=639 Win=30208 Len=0 TSval=649281755 TSecr=1473351251
9.805893230  TCP      56     60222 → 8883 [RST] Seq=639 Win=0 Len=0
9.815893942  TCP      76     8883 → 44766 [SYN, ACK] Seq=0 Ack=1 Win=28960 Len=0 MSS=1460 SACK_PERM=1 TSval=649282104 TSecr=2602525461 WS=256
9.815950992  TCP      68     44766 → 8883 [ACK] Seq=1 Ack=1 Win=26368 Len=0 TSval=2602525507 TSecr=649282104
9.816531086  TLSv1.2  411    Client Hello
9.861350132  TCP      68     8883 → 44766 [ACK] Seq=1 Ack=344 Win=30208 Len=0 TSval=649282116 TSecr=2602525508
9.861351119  TLSv1.2  1370   Server Hello
9.861422053  TCP      68     44766 → 8883 [ACK] Seq=344 Ack=1303 Win=28928 Len=0 TSval=2602525553 TSecr=649282116
9.861351474  TCP      1370   8883 → 44766 [ACK] Seq=1303 Ack=344 Win=30208 Len=1302 TSval=649282116 TSecr=2602525508 [TCP segment of a reassembled PDU]
9.861446444  TCP      68     44766 → 8883 [ACK] Seq=344 Ack=2605 Win=31488 Len=0 TSval=2602525553 TSecr=649282116
9.862395664  TCP      1370   8883 → 44766 [ACK] Seq=2605 Ack=344 Win=30208 Len=1302 TSval=649282116 TSecr=2602525508 [TCP segment of a reassembled PDU]
9.862419034  TCP      68     44766 → 8883 [ACK] Seq=344 Ack=3907 Win=34176 Len=0 TSval=2602525554 TSecr=649282116
9.862396632  TCP      258    8883 → 44766 [PSH, ACK] Seq=3907 Ack=344 Win=30208 Len=190 TSval=649282116 TSecr=2602525508 [TCP segment of a reassembled PDU]
9.862440591  TCP      68     44766 → 8883 [ACK] Seq=344 Ack=4097 Win=36736 Len=0 TSval=2602525554 TSecr=649282116
9.863568596  TLSv1.2  1006   Certificate, Server Key Exchange, Server Hello Done
9.863594338  TCP      68     44766 → 8883 [ACK] Seq=344 Ack=5035 Win=39424 Len=0 TSval=2602525555 TSecr=649282116
19.93872418  TLSv1.2  99     Application Data
19.99218679  TLSv1.2  99     Application Data
19.99221916  TCP      68     46590 → 8883 [ACK] Seq=32 Ack=32 Win=308 Len=0 TSval=351264079 TSecr=649284390
```
In the second 9.75 the reconnection is triggered and the connection seems to complete. Even in the second 19.9 I can see what might be a ping. But neither the log shows the CONACK, nor the connection callback is run.

This was working with mosquitto v1.4.8 and v1.4.10 by the way.

**Comment by doragasu** [comment]
I have run some more tests, and I do not know what is the data at the end of the capture, but I it might not be an echo. On the other tests I made, the timing of this data varies, and also about 60 seconds after the reconnect, the connection is abruptly closed (mosquitto sends a RST to the broker, and calls the disconnection callback).

**Comment by ralight** [comment]
I am sure that the data at the end of the capture is the CONNACK packet. Try it without using TLS and you will see. I'm not sure what the problem is yet.

**Comment by doragasu** [comment]
I have continued debugging the issue, and I have discovered it was my bad, I was not adding the new socket to the epoll file descriptor when I did the reconnection. In case anyone is wondering, here is the fixed minimum working example:
```c
#include <mosquitto.h>
#include <stdio.h>
#include <sys/epoll.h>
#include <unistd.h>

#define USERNAME	"my_username"
#define PASSWORD	"my_password"
#define HOST		"my_broker.com"
#define CLIENT_ID 	USERNAME
#define PORT		8883
#define KEEPALIVE	60

#define EVENTS 		(EPOLLIN | EPOLLOUT | EPOLLERR | EPOLLHUP | EPOLLRDHUP | EPOLLET)

static bool connected = false;
static int epfd = -1;

static void connect_cb(struct mosquitto *mosq, void *priv, int rc)
{
	printf("%s: %i received (%s)\n", __func__, rc, mosquitto_connack_string(rc));
	connected = true;

	// Subscribe
	mosquitto_subscribe(mosq, NULL, "my/topic/#", 0);
}

static void disconnect_cb(struct mosquitto *mosq, void *priv, int rc)
{
	connected = false;
	printf("%s: %i received (%s)\n", __func__, rc, mosquitto_connack_string(rc));
	close(epfd);
	epfd = -1;
}

static void publish_cb(struct mosquitto *mosq, void *priv, int rc)
{
	printf("%s: %i received\n", __func__, rc);
}

static void message_cb(struct mosquitto *mosq, void *priv, const struct mosquitto_message *msg)
{
	printf("%s: received %d bytes\n", __func__, msg->payloadlen);
}

static void subscribe_cb(struct mosquitto *mosq, void *priv, int mid, int qos_count, const int *granted_qos)
{
	printf("%s: %i %i received\n", __func__, mid, qos_count);
}

static void unsubscribe_cb(struct mosquitto *mosq, void *priv, int rc)
{
	printf("%s: %i received\n", __func__, rc);
}

static void log_cb(struct mosquitto *mosq, void *priv, int level, const char *msg)
{
	printf("%s: %i %s\n", __func__, level, msg);
}

static struct mosquitto* mosq_init(void)
{
	struct mosquitto *mosq = NULL;
	const char *client_id = CLIENT_ID;
	int err = 0;

	err = mosquitto_lib_init();
	if (!err) {
		mosq = mosquitto_new(client_id, true, NULL);
		err = mosq == NULL?-2:0;
	}
	if (!err) err = mosquitto_username_pw_set(mosq, USERNAME, PASSWORD);
	if (!err) err = mosquitto_tls_set(mosq, NULL, "/etc/ssl/certs", NULL, NULL, NULL);
	if (!err) {
		mosquitto_connect_callback_set(mosq, connect_cb);
		mosquitto_disconnect_callback_set(mosq, disconnect_cb);
		mosquitto_publish_callback_set(mosq, publish_cb);
		mosquitto_message_callback_set(mosq, message_cb);
		mosquitto_subscribe_callback_set(mosq, subscribe_cb);
		mosquitto_unsubscribe_callback_set(mosq, unsubscribe_cb);
		mosquitto_log_callback_set(mosq, log_cb);
		mosquitto_max_pub_queue_messages_set(mosq, 1000);
	}
	printf("%s: code %d\n", __func__, err);

	if (err && mosq) {
		mosquitto_destroy(mosq);
		mosq = NULL;
	}

	return mosq;
}

static int reconnect_test(struct mosquitto *mosq)
{
	static int iterations = 0;

	if (connected) {
		iterations++;
		// 10 seconds approx
		if (iterations >= 40) {
			printf("%s: triggering reconnect\n", __func__);
			connected = false;
			mosquitto_reconnect(mosq);
			iterations = 0;
			return 1;
		}
	} else {
		iterations = 0;
	}

	return 0;
}

static int mosq_epfd_init(struct mosquitto *mosq, struct epoll_event *ev)
{
	int mosq_socket;
	int err = 0;

	epfd = epoll_create1(0);
	if (epfd < 0) err = -1;
	if (!err) {
		mosq_socket = mosquitto_socket(mosq);
		ev->data.fd = mosq_socket;
		ev->events = EVENTS;
		err = epoll_ctl(epfd, EPOLL_CTL_ADD, mosq_socket, ev);
	}
	return err;
}

int main(void)
{
	struct mosquitto *mosq = NULL;
	int err = 0;
	struct epoll_event ev;
	int writes = 0;
	int reads = 0;

	// Init and connect
	mosq = mosq_init();
	if (!mosq) err = -3;
	err = mosquitto_connect(mosq, HOST, PORT, KEEPALIVE);
	if (!err) err = mosq_epfd_init(mosq, &ev);

	// Loop
	while (!err) {
		err = epoll_wait(epfd, &ev, 1, 250);
		if (err < 0) err = -4;
		else if (err > 0) {
			// Event
			err = -5;
			if (ev.events & EPOLLIN) {
				printf("read %d triggered\n", ++reads);
				mosquitto_loop_read(mosq, 1);
				err = 0;
			}
			if (ev.events & EPOLLOUT) {
				if (mosquitto_want_write(mosq)) {
					printf("write %d triggered\n", ++writes);
					mosquitto_loop_write(mosq, 1);
				}
				err = 0;
			}
		}
		mosquitto_loop_misc(mosq);
		if (reconnect_test(mosq)) {
			err = mosq_epfd_init(mosq, &ev);
		}
	}

	printf("%s: ERROR %d\n", __func__, err);

	return err;
}
```

I am closing the issue, sorry about the noise.
