### ISSUE TITLE
Is mosquitto_sub really working with QoS 2??

### ISSUE THREAD

**Issue by jotaeler** [eclipse/mosquitto#679]
Hello eveyone, I'm actually testing mosquitto broker and having some issues.
I decided to use wireshark to have a look to the network traffic, then I faced that mosquitto_sub is not sending a subscribe packet with QoS 2.

Just to illustrate:

```
Frame 8: 89 bytes on wire (712 bits), 89 bytes captured (712 bits) on interface 0
Ethernet II, Src: AsustekC_09:b2:dc (54:04:a6:09:b2:dc), Dst: Raspberr_51:22:99 (b8:27:eb:51:22:99)
Internet Protocol Version 4, Src: 192.168.1.5, Dst: 192.168.1.150
Transmission Control Protocol, Src Port: 44594, Dst Port: 1883, Seq: 29, Ack: 5, Len: 23
MQ Telemetry Transport Protocol
    Subscribe Request
        1000 0010 = Header Flags: 0x82 (Subscribe Request)
            1000 .... = Message Type: Subscribe Request (8)
            .... 0... = DUP Flag: Not set
            .... .01. = QOS Level: Acknowledged deliver (1)
            .... ...0 = Retain: Not set
        Msg Len: 21
        Message Identifier: 1
        Topic: test/TEST-ID/pub
        .... ..10 = Granted Qos: Assured Delivery (2)
```

I used this command to subscribe:
`mosquitto_sub -h 192.168.1.150 -t test/TEST-ID/pub -c -q 2 --id laptop-test1`

Am I misunderstanding something?

**Comment by karlp** [comment]
that looks like a bug in whatever MQTT protocol decoder you're using.  You can see that it _grants_ qos 2, which it would never do unless you were requesting qos 2.  I wasn't aware that there was an mqtt decoder standard yet?  Where did you get yours from?

**Comment by jotaeler** [comment]
It comes with Wireshark 2.2.6 in default installation. Not sure what's going on.
In my initial configuration I subscribed to broker with -c argument and I assumed that way I would receive messages If my subscriber client got disconnected, but broker only kept a few messages.
Then I added -q 2 argument, it seems to work as expected, but when I analyzed the network traffic, that output made me doubt.

**Comment by karlp** [comment]
I can confirm, this is a bug in the decoder.  It's attempting to decoder header fields for type 0x82 (Subscribe request) as if they are.... something else.  The actuall _payload_ (variable header) of the subscribe request is decoded correctly.

I'm still curious what led you to even _consider_ that this was a bug in mosquitto?

**Comment by karlp** [comment]
the number of messages kept for offline client's is the ```max_queued_messages``` setting.

**Comment by jotaeler** [comment]
Sure but, If I subscribe (with the same config) without `-q 2` argument to the broker, even if `max_queued_messages` is set to 2000, It only keep about 100 messages, after Client timeout (in log file) every message is dropped out.
I don't know why, that's because I started to sniff packets.

Thanks a lot!

**Comment by karlp** [comment]
Please list out exactly what steps you're taking.  For offline queueing you need:

- fixed client id
- qos > 0
- clean session false

You need to _subscribe_ first, then disconnect (without sending an unsubscribe)
If you then reconnect, with the _same_ clientid, and also with clean session false, you will get your saved messages, as per the mosquitto config for queued messages.

If mosquitto is queueing less, are you sure that you're editing the correct config file for your distribution, and that it has in fact been reloaded?

**Comment by jotaeler** [comment]
Yeah that was my mistake! I assumed clean session false was enough for offline queuing and ignore to set qos > 0 at subscribing.

Thanks you

**Comment by cjmaynard** [comment]
Please file a [Wireshark bug report](https://bugs.wireshark.org/bugzilla/) and attach a sample pcap file that helps illustrate the problem so dissection can be fixed before the next stable release, which typically comes out around the next [US Sharkfest](https://sharkfestus.wireshark.org/).

**Comment by jotaeler** [comment]
@cjmaynard Already done! Thanks you
