### ISSUE TITLE
mosquitto_sub and topic aliases

### ISSUE THREAD

**Issue by larshesel** [eclipse/mosquitto#1468]
I was playing with topic aliases with VerneMQ and the mosquitto tools (version 1.6.7) and stumbled over something which I think might be a bug in mosquitto_sub. 

The client connects telling the broker that the topic alias maximum is 10 and subscribes to topic `status/0123456789ABCDEF` as well. The first message received includes the topic and payload as expected as well as a topic alias with the value 1. The subsequent message is the same, but with a topic of length 0.

Below is the output of the client:

```shell
$ mosquitto_sub -i subscriber -t status/0123456789ABCDEF -F %j -V 5 -D connect topic-alias-maximum 10 -d -v
Client subscriber sending CONNECT
Client subscriber received CONNACK (0)
Client subscriber sending SUBSCRIBE (Mid: 1, Topic: status/0123456789ABCDEF, QoS: 0, Options: 0x00)
Client subscriber received SUBACK
Subscribed (mid: 1): 0
Client subscriber received PUBLISH (d0, q0, r0, m0, 'status/0123456789ABCDEF', ... (5 bytes))
{"tst":1571812105,"topic":"status/0123456789ABCDEF","qos":0,"retain":0,"payloadlen":5,"payload":"hello"}
Error: A network protocol error occurred when communicating with the broker.
```

And here the corresponding wireshark trace:
```wireshark
No.     Time           Source                Destination           Protocol Length Info
    244 16.609407345   127.0.0.1             127.0.0.1             MQTT     99     Connect Command

Frame 244: 99 bytes on wire (792 bits), 99 bytes captured (792 bits) on interface 0
Linux cooked capture
Internet Protocol Version 4, Src: 127.0.0.1, Dst: 127.0.0.1
Transmission Control Protocol, Src Port: 35188, Dst Port: 1883, Seq: 1, Ack: 1, Len: 31
MQ Telemetry Transport Protocol, Connect Command
    Header Flags: 0x10, Message Type: Connect Command
    Msg Len: 29
    Protocol Name Length: 4
    Protocol Name: MQTT
    Version: MQTT v5.0 (5)
    Connect Flags: 0x02, QoS Level: At most once delivery (Fire and Forget), Clean Session Flag
    Keep Alive: 60
    Properties
        Total Length: 6
        ID: Topic Alias Maximum (0x22)
        Value: 10
        ID: Receive Maximum (0x21)
        Value: 20
    Client ID Length: 10
    Client ID: subscriber

No.     Time           Source                Destination           Protocol Length Info
    246 16.613574441   127.0.0.1             127.0.0.1             MQTT     76     Connect Ack

Frame 246: 76 bytes on wire (608 bits), 76 bytes captured (608 bits) on interface 0
Linux cooked capture
Internet Protocol Version 4, Src: 127.0.0.1, Dst: 127.0.0.1
Transmission Control Protocol, Src Port: 1883, Dst Port: 35188, Seq: 1, Ack: 32, Len: 8
MQ Telemetry Transport Protocol, Connect Ack
    Header Flags: 0x20, Message Type: Connect Ack
    Msg Len: 6
    Acknowledge Flags: 0x00
    Reason Code: Success (0)
    Properties
        Total Length: 3
        ID: Topic Alias Maximum (0x22)
        Value: 10

No.     Time           Source                Destination           Protocol Length Info
    248 16.613995795   127.0.0.1             127.0.0.1             MQTT     99     Subscribe Request (id=1) [status/0123456789ABCDEF]

Frame 248: 99 bytes on wire (792 bits), 99 bytes captured (792 bits) on interface 0
Linux cooked capture
Internet Protocol Version 4, Src: 127.0.0.1, Dst: 127.0.0.1
Transmission Control Protocol, Src Port: 35188, Dst Port: 1883, Seq: 32, Ack: 9, Len: 31
MQ Telemetry Transport Protocol, Subscribe Request
    Header Flags: 0x82, Message Type: Subscribe Request
    Msg Len: 29
    Message Identifier: 1
    Properties
        Total Length: 0
    Topic Length: 23
    Topic: status/0123456789ABCDEF
    Subscription Options: 0x00, Retain Handling: Send msgs at subscription time, QoS: At most once delivery (Fire and Forget)

No.     Time           Source                Destination           Protocol Length Info
    249 16.616142673   127.0.0.1             127.0.0.1             MQTT     74     Subscribe Ack (id=1)

Frame 249: 74 bytes on wire (592 bits), 74 bytes captured (592 bits) on interface 0
Linux cooked capture
Internet Protocol Version 4, Src: 127.0.0.1, Dst: 127.0.0.1
Transmission Control Protocol, Src Port: 1883, Dst Port: 35188, Seq: 9, Ack: 63, Len: 6
MQ Telemetry Transport Protocol, Subscribe Ack
    Header Flags: 0x90, Message Type: Subscribe Ack
    Msg Len: 4
    Message Identifier: 1
    Properties
        Total Length: 0
    Reason Code: Granted QoS 0 (0)

No.     Time           Source                Destination           Protocol Length Info
    337 22.451642883   127.0.0.1             127.0.0.1             MQTT     104    Publish Message [status/0123456789ABCDEF]

Frame 337: 104 bytes on wire (832 bits), 104 bytes captured (832 bits) on interface 0
Linux cooked capture
Internet Protocol Version 4, Src: 127.0.0.1, Dst: 127.0.0.1
Transmission Control Protocol, Src Port: 1883, Dst Port: 35188, Seq: 15, Ack: 63, Len: 36
MQ Telemetry Transport Protocol, Publish Message
    Header Flags: 0x30, Message Type: Publish Message, QoS Level: At most once delivery (Fire and Forget)
    Msg Len: 34
    Topic Length: 23
    Topic: status/0123456789ABCDEF
    Properties
        Total Length: 3
        ID: Topic Alias (0x23)
        Value: 1
    Message: hello

No.     Time           Source                Destination           Protocol Length Info
    359 23.990974579   127.0.0.1             127.0.0.1             MQTT     81     Publish Message []

Frame 359: 81 bytes on wire (648 bits), 81 bytes captured (648 bits) on interface 0
Linux cooked capture
Internet Protocol Version 4, Src: 127.0.0.1, Dst: 127.0.0.1
Transmission Control Protocol, Src Port: 1883, Dst Port: 35188, Seq: 51, Ack: 63, Len: 13
MQ Telemetry Transport Protocol, Publish Message
    Header Flags: 0x30, Message Type: Publish Message, QoS Level: At most once delivery (Fire and Forget)
    Msg Len: 11
    Topic Length: 0
    Topic: 
    Properties
        Total Length: 3
        ID: Topic Alias (0x23)
        Value: 1
    Message: hello

```

The subscriber terminates after receiving the last frame (frame 359).

**Comment by dustin** [comment]
> The client connects telling the broker that the topic alias maximum is 10

The connect does not have a topic alias maximum property in the above trace.

**Comment by larshesel** [comment]
> The connect does not have a topic alias maximum property in the above trace.

You're absolutely correct - I had unfortunately copied the wrong wireshark trace.... sorry about that. I've edited with the correct one.

**Comment by ralight** [comment]
Support for topic aliases has been changed quite a bit in more recent versions, so I'm closing this issue. If you still have a problem please reopen and add more information.
