### ISSUE TITLE
No LWT after correct disconnect() and keep_alive timeout?

### ISSUE THREAD

**Issue by stko** [eclipse/mosquitto#916]
Problem: I would expect the LWT topic to be published also after a correct disconnect() and a following keep-alive timeout, but neither my local setups nor test.mosquitto.org do sent this?

Wireshark shows a connect() packet containing the WILL massage

```
Frame 4: 119 bytes on wire (952 bits), 119 bytes captured (952 bits) on interface 0
Linux cooked capture
Internet Protocol Version 4, Src: 127.0.0.1, Dst: 127.0.1.1
Transmission Control Protocol, Src Port: 36934, Dst Port: 1883, Seq: 1, Ack: 1, Len: 51
MQ Telemetry Transport Protocol
    Connect Command
        0001 0000 = Header Flags: 0x10 (Connect Command)
            0001 .... = Message Type: Connect Command (1)
            .... 0... = DUP Flag: Not set
            .... .00. = QOS Level: Fire and Forget (0)
            .... ...0 = Retain: Not set
        Msg Len: 49
        Protocol Name: MQTT
        Version: 4
        0000 0110 = Connect Flags: 0x06
            0... .... = User Name Flag: Not set
            .0.. .... = Password Flag: Not set
            ..0. .... = Will Retain: Not set
            ...0 0... = QOS Level: Fire and Forget (0)
            .... .1.. = Will Flag: Set
            .... ..1. = Clean Session Flag: Set
            .... ...0 = (Reserved): Not set
        Keep Alive: 10
        Client ID: 
        Will Topic: stacksk/clientstatus
        Will Message: LOST_CONNECTION
```
when using this helping script:
```
import paho.mqtt.client as mqtt

host = "test.mosquitto.org"
port = 1883
timeout = 10

client = mqtt.Client()
client.will_set("stacksk/clientstatus", "LOST_CONNECTION", 0, False)
client.connect(host, port, timeout)

client.publish("stack/clientstatus", "ON-LINE")

client.loop_start()
for msg in ["msg1", "msg2", "msg3"]:
    client.publish("stacksk/message", msg)
    print (msg)

client.publish("stacksk/clientstatus", "OFF-LINE")
client.disconnect()
client.loop_stop()  # waits, until DISCONNECT message is sent out
print ("Now I am done.")
```
while listening via
   mosquitto_sub -h test.mosquitto.org -v -t stacksk/# 

```
stacksk/message msg1
stacksk/message msg2
stacksk/message msg3
stacksk/clientstatus OFF-LINE
```

but even after a long time (means longer as the given time out of 10 secs,), I can't receive the WILL message neither on local setups nor on test.mosquitto.org. If I comment out the 'client.disconnect()', then the last WILL is sent.

What's wrong? Is the error located behind or in front of the screen? ;-)

regards
Steffen

**Comment by stko** [comment]
Alright, I understand that I should not use Disconnect(). But what's then the right way to switch off my IoT device during the keep-alive time? As soon as the device falls asleep, the connection seems to appear as broken to mosquitto, and the LWT is sent instantly, while I thought that should happen not before the keep alive time is running out.. Does that mean that I could not switch off the device at all?


(I'll close that issue here, as it is obviously no mosquitto misbehaviour)

**Comment by ralight** [comment]
Mosquitto will send the LWT as soon as it detects that the connection has failed. In some cases that can be detected instantly, but others not. You could imagine your application crashing in such a way that the network connection wasn't dropped, but it was no longer responding in any useful way for example. In that case, the keepalive duration is used to detect that the client is no longer available.

MQTT v5 has greater scope for control of the LWT, including being able to defer it which would allow you to mimic the behaviour that you are describing or to guard against brief outages, for example.

**Comment by stko** [comment]
I just looked into the v5 spec. I think with v5 I could set the will delay to e.g. 5 mins, and then disconnect() e.g. with response code 128. When I then restart and re-connect() my sensor after 4 mins, no last Will would be sent. Only if the sensor would not come back in time, the LWT would  be sent.

I think that's what I want, so I'll just do the lazy part and  sit and wait for the v5 libraries and programs to come...
Many thanks for your efforts and good luck for mosquitto

regards
Steffen
